{"account_id":"account-vector-01","claim_nonce":"AQIDBAUGBwgJCgsMDQ4PEBESExQVFhcYGRobHB0eHyA=","expires_at":1787817900000,"pairing_id":"pairing-vector-01","pairing_nonce":"ISIjJCUmJygpKissLS4vMDEyMzQ1Njc4OTo7PD0+P0A=","type":"pairing_offer","v":1,"viewer_device_id":"viewer-vector-01","viewer_ephemeral_key":"2J47rXlDfb7Z+ENBgwT0YP8Fx/6B/kqVd6gEy5Nn/2Y=","viewer_fingerprint":"KGOK-5E7J-HLIB-DV4F","viewer_signing_key":"zRSzf5VulTGU/3+3Oz2B3MVh1hp1OAlLfD4aZD7l86o="}